{
  "execution": {
    "mode": "global"
  },
  "param_overrides": {
    "pos_density": 0.25,
    "neg_density": 0.25,
    "association_kernel": "correlation"
  },
  "checks": {
    "forbid_self_loops": true
  },
  "variants": [
    {
      "name": "global",
      "checks": {
        "require_unique_unordered_pairs": true,
        "forbid_self_loops": true
      }
    }
  ]
}
