{
  "execution": {
    "mode": "global"
  },
  "require_progress": true,
  "checks": {
    "require_unique_unordered_pairs": true,
    "forbid_self_loops": true
  },
  "param_overrides": {
    "discretizer": "uniform_width",
    "number_of_bins": 4
  },
  "variants": [
    {
      "name": "global_uniform_width"
    },
    {
      "name": "global_uniform_count",
      "param_overrides": {
        "discretizer": "uniform_count",
        "number_of_bins": 4
      }
    }
  ]
}
