{
  "execution": {
    "mode": "column_native"
  },
  "param_overrides": {
    "nfeatures": 15,
    "knn": 2
  },
  "checks": {
    "forbid_self_loops": true
  },
  "variants": [
    {
      "name": "default"
    },
    {
      "name": "fewer_than_ten_pcs",
      "param_overrides": {
        "nfeatures": 8
      }
    }
  ]
}
