{
  "execution": {
    "mode": "column_native"
  },
  "param_overrides": {
    "pca_components": 3,
    "n_neigh": 6,
    "lamb": 0.01,
    "max_iters": 1,
    "n_intervals": 1,
    "batch_size": 30
  },
  "checks": {
    "forbid_self_loops": true
  },
  "variants": [
    {
      "name": "column_native"
    },
    {
      "name": "column_native_spatial",
      "extra_files": [
        "spatial_coordinates.tsv"
      ],
      "param_overrides": {
        "kernel_source": "spatial"
      }
    }
  ]
}
